<!DOCTYPE dataset SYSTEM "../dtd/flatDtdProducerTest.dtd">
<dataset>
	<DUPLICATE_TABLE COLUMN0="row 0 col 0" COLUMN1="row 0 col 1" COLUMN2="row 0 col 2" COLUMN3="row 0 col 3"/>
	<SECOND_TABLE COLUMN0="row 0 col 0" COLUMN1="row 0 col 1" COLUMN2="row 0 col 2" COLUMN3="row 0 col 3"/>
	<SECOND_TABLE COLUMN0="row 1 col 0" COLUMN1="row 1 col 1" COLUMN2="row 1 col 2" COLUMN3="row 1 col 3"/>
	<TEST_TABLE COLUMN0="row 0 col 0" COLUMN1="row 0 col 1" COLUMN2="row 0 col 2" COLUMN3="row 0 col 3"/>
	<TEST_TABLE COLUMN0="row 1 col 0" COLUMN1="row 1 col 1" COLUMN2="row 1 col 2" COLUMN3="row 1 col 3"/>
	<TEST_TABLE COLUMN0="row 2 col 0" COLUMN1="row 2 col 1" COLUMN2="row 2 col 2" COLUMN3="row 2 col 3"/>
	<NOT_NULL_TABLE COLUMN0="row 0 col 0" COLUMN1="row 0 col 1" COLUMN2="row 0 col 2" COLUMN3="row 0 col 3"/>
	<EMPTY_TABLE/>
</dataset>
